{
  "suite_id": "cec2021",
  "name": "CEC 2021 Bound-Constrained Single Objective Benchmark",
  "description": "CEC 2021 10-function suite using the generic hybrid/composition config schema.",
  "version": "1.0",
  "functions": [
    {
      "id": "cec21_f01_bent_cigar",
      "category": "Unimodal",
      "function": {
        "type": "bias",
        "parameters": {
          "value": 100
        },
        "function": {
          "type": "bent_cigar",
          "function": {
            "type": "rotate",
            "parameters": {
              "transpose": true,
              "matrix": "f01/M_D{dim}.txt"
            },
            "function": {
              "type": "shift",
              "parameters": {
                "vector": "f01/shift_data.txt"
              }
            }
          }
        }
      },
      "dimensions": {
        "supported": [
          10,
          20
        ],
        "default": 10,
        "custom_dimensions": {
          "min": 10,
          "max": 20,
          "step": 10,
          "quantization": null
        }
      },
      "search_space": {
        "default_bounds": {
          "min": -100,
          "max": 100
        }
      }
    },
    {
      "id": "cec21_f02_rotated_schwefel",
      "category": "Multimodal",
      "function": {
        "type": "bias",
        "parameters": {
          "value": 1100
        },
        "function": {
          "type": "schwefel_sin",
          "parameters": {
            "boundary_handling": true
          },
          "function": {
            "type": "offset",
            "parameters": {
              "value": 420.9687462275036
            },
            "function": {
              "type": "rotate",
              "parameters": {
                "transpose": true,
                "matrix": "f02/M_D{dim}.txt"
              },
              "function": {
                "type": "scale",
                "parameters": {
                  "factor": 10.0,
                  "multiply": true
                },
                "function": {
                  "type": "shift",
                  "parameters": {
                    "vector": "f02/shift_data.txt"
                  }
                }
              }
            }
          }
        }
      },
      "dimensions": {
        "supported": [
          10,
          20
        ],
        "default": 10,
        "custom_dimensions": {
          "min": 10,
          "max": 20,
          "step": 10,
          "quantization": null
        }
      },
      "search_space": {
        "default_bounds": {
          "min": -100,
          "max": 100
        }
      }
    },
    {
      "id": "cec21_f03_lunacek",
      "category": "Multimodal",
      "function": {
        "type": "bias",
        "parameters": {
          "value": 700
        },
        "function": {
          "type": "lunacek_rotated_cosine",
          "parameters": {
            "cosine_rotation": "f03/M_D{dim}.txt",
            "shift_signs": "f03/shift_data.txt"
          },
          "function": {
            "type": "scale",
            "parameters": {
              "factor": 0.1,
              "multiply": true
            },
            "function": {
              "type": "shift",
              "parameters": {
                "vector": "f03/shift_data.txt"
              }
            }
          }
        }
      },
      "dimensions": {
        "supported": [
          10,
          20
        ],
        "default": 10,
        "custom_dimensions": {
          "min": 10,
          "max": 20,
          "step": 10,
          "quantization": null
        }
      },
      "search_space": {
        "default_bounds": {
          "min": -100,
          "max": 100
        }
      }
    },
    {
      "id": "cec21_f04_griewank_rosenbrock",
      "category": "Multimodal",
      "function": {
        "type": "bias",
        "parameters": {
          "value": 1900
        },
        "function": {
          "type": "griewank_of_rosenbrock",
          "function": {
            "type": "offset",
            "parameters": {
              "value": 1.0
            },
            "function": {
              "type": "rotate",
              "parameters": {
                "transpose": true,
                "matrix": "f04/M_D{dim}.txt"
              },
              "function": {
                "type": "scale",
                "parameters": {
                  "factor": 0.05,
                  "multiply": true
                },
                "function": {
                  "type": "shift",
                  "parameters": {
                    "vector": "f04/shift_data.txt"
                  }
                }
              }
            }
          }
        }
      },
      "dimensions": {
        "supported": [
          10,
          20
        ],
        "default": 10,
        "custom_dimensions": {
          "min": 10,
          "max": 20,
          "step": 10,
          "quantization": null
        }
      },
      "search_space": {
        "default_bounds": {
          "min": -100,
          "max": 100
        }
      }
    },
    {
      "id": "cec21_f05_hybrid_1",
      "category": "Hybrid Composition",
      "function": {
        "type": "bias",
        "parameters": {
          "value": 1700
        },
        "function": {
          "type": "hybrid",
          "parameters": {
            "shuffle": "f05/shuffle_D{dim}.txt",
            "percentages": [
              0.3,
              0.3,
              0.4
            ]
          },
          "function": {
            "type": "rotate",
            "parameters": {
              "transpose": true,
              "matrix": "f05/M_D{dim}.txt"
            },
            "function": {
              "type": "scale",
              "parameters": {
                "factor": 1.0,
                "multiply": true
              },
              "function": {
                "type": "shift",
                "parameters": {
                  "vector": "f05/shift_data.txt"
                }
              }
            }
          },
          "functions": [
            {
              "type": "offset",
              "parameters": {
                "value": 420.9687462275036
              },
              "function": {
                "type": "scale",
                "parameters": {
                  "factor": 10.0,
                  "multiply": true
                },
                "function": {
                  "type": "schwefel_sin",
                  "parameters": {
                    "boundary_handling": true
                  }
                }
              }
            },
            {
              "type": "scale",
              "parameters": {
                "factor": 0.0512,
                "multiply": true
              },
              "function": {
                "type": "rastrigin"
              }
            },
            {
              "type": "high_conditioned_elliptic"
            }
          ]
        }
      },
      "dimensions": {
        "supported": [
          10,
          20
        ],
        "default": 10,
        "custom_dimensions": {
          "min": 10,
          "max": 20,
          "step": 10,
          "quantization": null
        }
      },
      "search_space": {
        "default_bounds": {
          "min": -100,
          "max": 100
        }
      }
    },
    {
      "id": "cec21_f06_hybrid_6",
      "category": "Hybrid Composition",
      "function": {
        "type": "bias",
        "parameters": {
          "value": 1600
        },
        "function": {
          "type": "hybrid",
          "parameters": {
            "shuffle": "f06/shuffle_D{dim}.txt",
            "percentages": [
              0.2,
              0.2,
              0.3,
              0.3
            ]
          },
          "function": {
            "type": "rotate",
            "parameters": {
              "transpose": true,
              "matrix": "f06/M_D{dim}.txt"
            },
            "function": {
              "type": "scale",
              "parameters": {
                "factor": 1.0,
                "multiply": true
              },
              "function": {
                "type": "shift",
                "parameters": {
                  "vector": "f06/shift_data.txt"
                }
              }
            }
          },
          "functions": [
            {
              "type": "schaffer_f6_expanded"
            },
            {
              "type": "offset",
              "parameters": {
                "value": -1.0
              },
              "function": {
                "type": "scale",
                "parameters": {
                  "factor": 0.05,
                  "multiply": true
                },
                "function": {
                  "type": "hgbat"
                }
              }
            },
            {
              "type": "offset",
              "parameters": {
                "value": 1.0
              },
              "function": {
                "type": "scale",
                "parameters": {
                  "factor": 0.02048,
                  "multiply": true
                },
                "function": {
                  "type": "rosenbrock"
                }
              }
            },
            {
              "type": "offset",
              "parameters": {
                "value": 420.9687462275036
              },
              "function": {
                "type": "scale",
                "parameters": {
                  "factor": 10.0,
                  "multiply": true
                },
                "function": {
                  "type": "schwefel_sin",
                  "parameters": {
                    "boundary_handling": true
                  }
                }
              }
            }
          ]
        }
      },
      "dimensions": {
        "supported": [
          10,
          20
        ],
        "default": 10,
        "custom_dimensions": {